{
  "$schema": "https://json-schema.org/draft/2020-12/schema",
  "$id": "https://morph-replay-runner.local/schemas/mrr/execution_profile.v1.json",
  "title": "ExecutionProfile",
  "description": "Pinned hermetic execution profile. Secrets by reference only.",
  "type": "object",
  "additionalProperties": false,
  "required": [
    "schema_version",
    "profile_id",
    "snapshot",
    "container_image_digests",
    "environment",
    "os_runtime",
    "dependency_lock_digest",
    "network_policy",
    "clock_policy",
    "random_seed_policy",
    "tool_versions",
    "budgets",
    "secret_refs",
    "output_retention",
    "source_commit",
    "integrity"
  ],
  "properties": {
    "schema_version": { "const": "mrr.ExecutionProfile.v1" },
    "profile_id": { "type": "string", "minLength": 1 },
    "profile_digest": {
      "type": "string",
      "pattern": "^sha256:[a-f0-9]{64}$",
      "description": "Optional precomputed digest; recomputed on validate."
    },
    "snapshot": {
      "type": "object",
      "additionalProperties": false,
      "required": ["snapshot_id", "snapshot_digest"],
      "properties": {
        "snapshot_id": { "type": "string", "minLength": 1 },
        "snapshot_digest": {
          "type": "string",
          "pattern": "^sha256:[a-f0-9]{64}$"
        }
      }
    },
    "container_image_digests": {
      "type": "array",
      "minItems": 1,
      "items": { "type": "string", "pattern": "^sha256:[a-f0-9]{64}$" }
    },
    "environment": {
      "type": "object",
      "additionalProperties": false,
      "required": ["profile_name", "profile_version"],
      "properties": {
        "profile_name": { "type": "string", "minLength": 1 },
        "profile_version": { "type": "string", "minLength": 1 }
      }
    },
    "os_runtime": {
      "type": "object",
      "additionalProperties": false,
      "required": ["os", "runtime"],
      "properties": {
        "os": { "type": "string", "minLength": 1 },
        "runtime": { "type": "string", "minLength": 1 }
      }
    },
    "dependency_lock_digest": {
      "type": "string",
      "pattern": "^sha256:[a-f0-9]{64}$"
    },
    "network_policy": {
      "type": "object",
      "additionalProperties": false,
      "required": ["mode"],
      "properties": {
        "mode": {
          "type": "string",
          "enum": [
            "no_network",
            "allowlisted_network",
            "recorded_response",
            "partner_local",
            "synthetic_dependency"
          ]
        },
        "allowlist_hosts": {
          "type": "array",
          "items": { "type": "string", "minLength": 1 }
        },
        "cassette_digest": {
          "type": "string",
          "pattern": "^sha256:[a-f0-9]{64}$"
        },
        "partner_local_paths": {
          "type": "array",
          "items": { "type": "string", "minLength": 1 }
        },
        "synthetic_dependency_digests": {
          "type": "array",
          "items": { "type": "string", "pattern": "^sha256:[a-f0-9]{64}$" }
        }
      }
    },
    "clock_policy": {
      "type": "object",
      "additionalProperties": false,
      "required": ["mode", "fixed_epoch_ms"],
      "properties": {
        "mode": { "type": "string", "enum": ["frozen", "offset"] },
        "fixed_epoch_ms": { "type": "integer", "minimum": 0 }
      }
    },
    "random_seed_policy": {
      "type": "object",
      "additionalProperties": false,
      "required": ["seed"],
      "properties": {
        "seed": { "type": "integer", "minimum": 0 }
      }
    },
    "tool_versions": {
      "type": "object",
      "additionalProperties": { "type": "string", "minLength": 1 },
      "minProperties": 1
    },
    "model": {
      "type": "object",
      "additionalProperties": false,
      "properties": {
        "endpoint": { "type": "string", "minLength": 1 },
        "version": { "type": "string", "minLength": 1 },
        "local_checkpoint_digest": {
          "type": "string",
          "pattern": "^sha256:[a-f0-9]{64}$"
        }
      }
    },
    "budgets": {
      "type": "object",
      "additionalProperties": false,
      "required": [
        "cpu_cores",
        "memory_mib",
        "storage_mib",
        "wall_time_ms",
        "token_budget",
        "api_call_budget"
      ],
      "properties": {
        "cpu_cores": { "type": "integer", "minimum": 1 },
        "memory_mib": { "type": "integer", "minimum": 1 },
        "accelerator_count": { "type": "integer", "minimum": 0 },
        "storage_mib": { "type": "integer", "minimum": 1 },
        "wall_time_ms": { "type": "integer", "minimum": 1 },
        "token_budget": { "type": "integer", "minimum": 0 },
        "api_call_budget": { "type": "integer", "minimum": 0 }
      }
    },
    "secret_refs": {
      "type": "array",
      "items": {
        "type": "object",
        "additionalProperties": false,
        "required": ["secret_ref"],
        "properties": {
          "secret_ref": {
            "type": "string",
            "minLength": 1,
            "pattern": "^[A-Za-z0-9_./:-]+$",
            "description": "Identifier only; secret values are rejected."
          },
          "purpose": { "type": "string" }
        }
      }
    },
    "output_retention": {
      "type": "object",
      "additionalProperties": false,
      "required": ["mode", "retention_days"],
      "properties": {
        "mode": { "type": "string", "enum": ["ephemeral", "retain"] },
        "retention_days": { "type": "integer", "minimum": 0 }
      }
    },
    "source_commit": {
      "type": "string",
      "pattern": "^[0-9a-f]{40}$"
    },
    "integrity": {
      "type": "object",
      "additionalProperties": false,
      "required": ["canonicalization_version"],
      "properties": {
        "canonicalization_version": { "const": "v1" },
        "artifact_digest": {
          "type": "string",
          "pattern": "^sha256:[a-f0-9]{64}$"
        }
      }
    }
  }
}
